{
  "name": "power-flow-dark",
  "mode": "dark",
  "direction": "TB",
  "labelMode": "emoji",
  "nodeStyles": {
    "scalar":   { "shape": "circle",  "fill": "#1b3a1e", "stroke": "#66bb6a", "color": "#c8e6c9" },
    "vector":   { "shape": "circle",  "fill": "#1b3a1e", "stroke": "#66bb6a", "color": "#c8e6c9" },
    "constant": { "shape": "circle",  "fill": "#1b3a1e", "stroke": "#66bb6a", "color": "#c8e6c9" },
    "number":   { "shape": "circle",  "fill": "#1b3a1e", "stroke": "#66bb6a", "color": "#c8e6c9" },
    "operator": { "shape": "hexagon", "fill": "#0f2540", "stroke": "#42a5f5", "color": "#bbdefb" },
    "function": { "shape": "hexagon", "fill": "#0f2540", "stroke": "#42a5f5", "color": "#bbdefb" },
    "relation": { "shape": "diamond", "fill": "#2e1b33", "stroke": "#ab47bc", "color": "#e1bee7" },
    "result":   { "shape": "stadium", "fill": "#332a0b", "stroke": "#ffa726", "color": "#ffe0b2" },
    "annotation": { "shape": "circle",  "fill": "#131a2c", "stroke": "#4a5580", "color": "#b0bcd0" }
  },
  "edgeStyles": {
    "direct":  { "stroke": "#ef5350", "strokeWidth": 4 },
    "inverse": { "stroke": "#42a5f5", "strokeWidth": 1 },
    "neutral": { "stroke": "#aaa",    "strokeWidth": 2 },
    "logical": { "stroke": "#e1bee7", "strokeWidth": 2, "arrow": "-.->" }
  },
  "paintBySemantic": true,
  "fontSize": 15
}
