{
  "name": "minimal-flat-dark",
  "mode": "dark",
  "direction": "LR",
  "labelMode": "emoji",
  "nodeStyles": {
    "scalar":   { "shape": "rect", "fill": "none", "stroke": "none", "color": "#bbb" },
    "vector":   { "shape": "rect", "fill": "none", "stroke": "none", "color": "#bbb" },
    "constant": { "shape": "rect", "fill": "none", "stroke": "none", "color": "#bbb" },
    "number":   { "shape": "rect", "fill": "none", "stroke": "none", "color": "#bbb" },
    "operator": { "shape": "rect", "fill": "none", "stroke": "none", "color": "#bbb" },
    "function": { "shape": "rect", "fill": "none", "stroke": "none", "color": "#bbb" },
    "relation": { "shape": "rect", "fill": "none", "stroke": "none", "color": "#bbb" },
    "result":   { "shape": "rect", "fill": "none", "stroke": "none", "color": "#bbb" },
    "annotation": { "shape": "circle",  "fill": "#14141e", "stroke": "#3a3a4a", "color": "#888" }
  },
  "edgeStyles": {
    "direct":  { "stroke": "#c06060", "strokeWidth": 1.5 },
    "inverse": { "stroke": "#6090b0", "strokeWidth": 1, "arrow": "-.->" },
    "neutral": { "stroke": "#888",    "strokeWidth": 1 }
  },
  "paintBySemantic": true,
  "fontSize": 16
}
