{
  "name": "power-flow-light",
  "mode": "light",
  "direction": "TB",
  "labelMode": "emoji",
  "nodeStyles": {
    "scalar":   { "shape": "circle",  "fill": "#e8f5e9", "stroke": "#66bb6a", "color": "#2e7d32" },
    "vector":   { "shape": "circle",  "fill": "#e8f5e9", "stroke": "#66bb6a", "color": "#2e7d32" },
    "constant": { "shape": "circle",  "fill": "#e8f5e9", "stroke": "#66bb6a", "color": "#2e7d32" },
    "number":   { "shape": "circle",  "fill": "#e8f5e9", "stroke": "#66bb6a", "color": "#2e7d32" },
    "operator": { "shape": "hexagon", "fill": "#e3f2fd", "stroke": "#42a5f5", "color": "#1565c0" },
    "function": { "shape": "hexagon", "fill": "#e3f2fd", "stroke": "#42a5f5", "color": "#1565c0" },
    "relation": { "shape": "diamond", "fill": "#f3e5f5", "stroke": "#ab47bc", "color": "#6a1b9a" },
    "result":   { "shape": "stadium", "fill": "#fff8e1", "stroke": "#ffa726", "color": "#e65100" },
    "annotation": { "shape": "circle",  "fill": "#eef1f8", "stroke": "#7888a8", "color": "#3a4560" }
  },
  "edgeStyles": {
    "direct":  { "stroke": "#ef5350", "strokeWidth": 4 },
    "inverse":   { "stroke": "#42a5f5", "strokeWidth": 1 },
    "neutral":  { "stroke": "#777",    "strokeWidth": 2 },
    "logical":  { "stroke": "#ab47bc", "strokeWidth": 2, "arrow": "-.->" }
  },
  "paintBySemantic": true,
  "fontSize": 15
}
