{
  "name": "blueprint-dark",
  "mode": "dark",
  "direction": "LR",
  "labelMode": "emoji",
  "nodeStyles": {
    "scalar":   { "shape": "rect",     "fill": "#0d1f2d", "stroke": "#5c8a9e", "color": "#a8d0e0" },
    "vector":   { "shape": "rect",     "fill": "#0d1f2d", "stroke": "#5c8a9e", "color": "#a8d0e0" },
    "constant": { "shape": "rect",     "fill": "#0d1f2d", "stroke": "#5c8a9e", "color": "#a8d0e0" },
    "number":   { "shape": "rect",     "fill": "#0d1f2d", "stroke": "#5c8a9e", "color": "#a8d0e0" },
    "relation": { "shape": "diamond",  "fill": "#1a1a2e", "stroke": "#7e57c2", "color": "#d1c4e9" },
    "result":   { "shape": "stadium",  "fill": "#0d2620", "stroke": "#26a69a", "color": "#b2dfdb" },
    "annotation": { "shape": "circle", "fill": "#131a2c", "stroke": "#4a5580", "color": "#b0bcd0" }
  },
  "operatorVariants": {
    "direct":  { "fill": "#2d1008", "stroke": "#ff8a65", "color": "#ffccbc", "strokeWidth": 3, "fontSize": 17 },
    "inverse": { "fill": "#1a1a2e", "stroke": "#7e57c2", "color": "#d1c4e9", "fontSize": 14 },
    "neutral": { "fill": "#0d1f2d", "stroke": "#5c8a9e", "color": "#a8d0e0" }
  },
  "edgeStyles": {
    "direct":  { "stroke": "#ef5350", "strokeWidth": 4, "arrow": "==>" },
    "inverse": { "stroke": "#42a5f5", "strokeWidth": 1, "arrow": "-.->" },
    "neutral": { "stroke": "#aaa",    "strokeWidth": 2, "arrow": "-->" },
    "logical": { "stroke": "#d1c4e9", "strokeWidth": 2, "arrow": "-.->" }
  },
  "paintBySemantic": true,
  "fontSize": 15
}
